name,summary,pattern
/qualtran/qualtran.bloqs.optimization.k_xor_sat.kikuchi_adjacency_matrix.KikuchiMatrixEntry,"Adjacency matrix oracle for the Kikuchi matrix.  Given a kXOR instance $\mathcal{I}$ with $n$ variables, $m$ constraints, the Kikuchi matrix with parameter $\ell$ is indexed by ${[n] \choose l}$. For $S, T \in {[n] \choose l}$, the entry is given by $H_{S, T} = B_{\mathcal{I}}(S \Delta T)/M$, where ",Domain Specific Application
/qualtran/qualtran.bloqs.optimization.k_xor_sat.kikuchi_block_encoding.BlackBoxKikuchiEntryOracle,Wrapper around the adjacency matrix oracle $O_H$ of the Kikuchi graph.,Domain Specific Application
/qualtran/qualtran.bloqs.optimization.k_xor_sat.kikuchi_block_encoding.BlackBoxKikuchiRowColumnOracle,Wrapper around the adjacency list oracle $O_F$ of the Kikuchi graph.,Domain Specific Application
/qualtran/qualtran.bloqs.optimization.k_xor_sat.kikuchi_block_encoding.KikuchiHamiltonian,"Block encoding of the Kikuchi matrix $\mathcal{K}_\ell$.  This is implemented by a sparse matrix block encoding using the adjacency matrix and adjacency list oracles.  This assumes a default sparsity of $\bar{m}$, which is the number of unique scopes in the instance $\mathcal{I}$. If a better bound ",Domain Specific Application
/qualtran/qualtran.bloqs.optimization.k_xor_sat.kikuchi_guiding_state.SimpleGuidingState,"Prepare the guiding state for $\ell = k$.  Given an kXOR instance $\mathcal{I}$, prepare the guiding state for parameter $\ell = k$ (i.e. $c = 1$), defined in Eq 134:     $$     |\phi\rangle     \propto     |\Gamma^k(\mathcal{A})\rangle     =     \frac{1}{\sqrt{\tilde{m}}}     \sum_{S \in {[n] \choo",Domain Specific Application
/qualtran/qualtran.bloqs.optimization.k_xor_sat.kikuchi_guiding_state.ProbabilisticUncompute,"Probabilistically uncompute a register using hadamards, and mark success in a flag qubit  Apply hadamards to the register, and mark the flag conditioned on all input qubits being 0.  References:     [Quartic quantum speedups for planted inference](https://arxiv.org/abs/2406.19378v1)     Eq. 129 and ",Domain Specific Application
/qualtran/qualtran.bloqs.optimization.k_xor_sat.kikuchi_guiding_state.GuidingState,"Prepare a guiding state for a kXOR instance with parameter $\ell$.  Given an kXOR instance $\mathcal{I}$, and parameter $\ell$ (a multiple of $k$), we want to prepare the unit-length guiding state $|\mathbb{\Psi}\rangle$ (Eq 135):      $$     |\mathbb{\Psi}\rangle     \propto     |\Gamma^\ell(\mathc",Domain Specific Application
/qualtran/qualtran.bloqs.optimization.k_xor_sat.load_kxor_instance.LoadConstraintScopes,"Given an index $j$, load the scope of the $j$-th unique constraint.  Given a $k$-XOR-SAT instance `inst` with $n$ variables and $m$ constraints. Assuming `inst` has $\bar{m}$ unique constraints, we define $U_j \in {[n] \choose k}$ for $j \in [\bar{m}]$ as the $j$-th unique constraint scope.  See :cl",Domain Specific Application
/qualtran/qualtran.bloqs.optimization.k_xor_sat.load_kxor_instance.LoadUniqueScopeIndex,"Given a scope $S$, load $j$ such that $S = U_j$, the $j$-th unique scope.  If the input contains an invalid scope, then any arbitrary value can be output.  See :class:`KXorInstance` for the overall problem definition.  Registers:     S: A scope $S \in {[n] \choose k}$.     j (RIGHT): a number in $[\",Domain Specific Application
/qualtran/qualtran.bloqs.optimization.k_xor_sat.load_kxor_instance.PRGAUniqueConstraintRHS,"Map $|j\rangle |0\rangle$ to $|j\rangle (\sqrt{E_j} |0\rangle + \sqrt{1 - |E_j|}|1\rangle)$  Given an instance $\mathcal{I}$, with unique scopes $U_j$ and corresponding RHS values $E_j = B_\mathcal{I}(U_j)/M$ (where $M$ is the max. abs. entry, usually 2) apply the above rotation on the target qubit.",Domain Specific Application
/qualtran/qualtran.bloqs.state_preparation.prepare_uniform_superposition.PrepareUniformSuperposition,"Prepares a uniform superposition over first $n$ basis states using $O(log(n))$ T-gates.  Performs a single round of amplitude amplification and prepares a uniform superposition over the first $n$ basis states $|0>, |1>, ..., |n - 1>$. The gate complexity is $10 * log(L) + 2 * K$ T gates and $2$ sing",Initialization
/qualtran/qualtran.bloqs.state_preparation.state_preparation_alias_sampling.StatePreparationAliasSampling,"Initialize a state with $L$ coefficients using coherent alias sampling.  In particular, given coefficients $w_\ell$, we take the zero state to:  $$ \sum_{\ell=0}^{L-1} \sqrt{p_\ell} |\ell\rangle |\mathrm{temp}_\ell\rangle $$  where the probabilities $p_\ell$ are $\mu$-bit binary approximations to th",Initialization
/qualtran/qualtran.bloqs.state_preparation.state_preparation_alias_sampling.SparseStatePreparationAliasSampling,"Initialize a $d$-sparse state over $L$ indices using coherent alias sampling.  In particular, we take the zero state to:  $$     \sum_{j=0}^{d-1} \sqrt{p_{\mathrm{ind}_j}} |\mathrm{ind}_j\rangle |\mathrm{temp}_j\rangle $$  where $\mathrm{ind}_j \in [0, L)$ is the index of the $j$-th non-zero coeffic",Initialization
/qualtran/qualtran.bloqs.state_preparation.state_preparation_via_rotation.StatePreparationViaRotations,Controlled state preparation without entangled residual using Ry and Rz rotations from [1].  Given a quantum state of which the list of coefficients $c_i$ is known $$     |\psi \rangle = \sum_{i=0}^{N-1}c_{i}|i\rangle $$ this gate prepares $|\psi\rangle$ from $|0\rangle$ conditioned by a control qub,Initialization
/qualtran/qualtran.bloqs.state_preparation.state_preparation_via_rotation.PRGAViaPhaseGradient,"Array of controlled rotations $Z^{\theta_i/2}$ for a list of angles $\theta$.  It uses phase kickback and thus needs a phase gradient state in order to work. This state must be provided externally for efficiency, as it is unaffected and can thus be reused. Refer to [1], section on arbitrary quantum ",Initialization
/qualtran/qualtran.bloqs.state_preparation.state_preparation_via_rotation.RotationTree,"Used by `StatePreparationViaRotations` to get the corresponding rotation angles.  The rotation angles are used to encode the amplitude of a state using the method described in [1], section on arbitrary quantum state preparation, page 3.  References:     [Trading T-gates for dirty qubits in state pre",Initialization
/qualtran/qualtran.bloqs.multiplexers.apply_gate_to_lth_target.ApplyGateToLthQubit,A controlled SELECT operation for single-qubit gates.  $$ \mathrm{SELECT} = \sum_{l}|l \rangle \langle l| \otimes [G(l)]_l $$  Where $G$ is a function that maps an index to a single-qubit gate.  This gate uses the unary iteration scheme to apply `nth_gate(selection)` to the `selection`-th qubit of `,Function Table
/qualtran/qualtran.bloqs.multiplexers.apply_lth_bloq.ApplyLthBloq,A SELECT operation that executes one of a list of bloqs $U_l$ based on a quantum index:  $$ \mathrm{SELECT} = \sum_{l}|l \rangle \langle l| \otimes U_l $$  This bloq uses the unary iteration scheme to apply `ops[selection]` controlled on an optional single-bit `control` register.  Args:     ops: NDA,Function Table
/qualtran/qualtran.bloqs.mcmt.and_bloq.And,A two-bit 'and' operation optimized for T-count.  Args:     cv1: Whether the first bit is a positive control.     cv2: Whether the second bit is a positive control.  Registers:     ctrl: A two-bit control register.     target [right]: The output bit.  References:     [Encoding Electronic Spectra in ,Quantum Logical Operators
/qualtran/qualtran.bloqs.mcmt.and_bloq.MultiAnd,"A many-bit (multi-control) 'and' operation.  Args:     cvs: A tuple of control variable settings. Each entry specifies whether that         control line is a ""positive"" control (`cv[i]=1`) or a ""negative"" control `0`.         If a HasLength object is passed, assumes the control values to be all 1's.",Quantum Logical Operators
/qualtran/qualtran.bloqs.mcmt.multi_control_pauli.MultiControlPauliBase,Abstract base class for MultiControlPauli and its specializations.,Quantum Logical Operators
/qualtran/qualtran.bloqs.mcmt.multi_control_pauli.MultiControlPauli,"Implements multi-control, single-target C^{n}P gate.  Implements $C^{n}P = (1 - |1^{n}><1^{n}|) I + |1^{n}><1^{n}| P^{n}$ using $n-1$ clean ancillas using a multi-controlled `AND` gate. Uses the Toffoli ladder construction described in ""n−2 Ancilla Bits"" section of Ref[1] but uses an $\text{AND} / \",Quantum Logical Operators
/qualtran/qualtran.bloqs.mcmt.multi_control_pauli.MultiControlX,"Implements multi-control, single-target X gate.  Reduces multiple controls to a single control using an `And` ladder. See class `ControlledViaAnd` for details on construction.  Alternatively, one can directly use `XGate().controlled(CtrlSpec(cvs=cvs))`  Args:     cvs: a tuple of `n` control bits, or",Quantum Logical Operators
/qualtran/qualtran.bloqs.mcmt.multi_control_pauli.MultiControlZ,"Implements multi-control, single-target Z gate.  Reduces multiple controls to a single control using an `And` ladder. See class `ControlledViaAnd` for details on construction.  Alternatively, one can directly use `ZGate().controlled(CtrlSpec(cvs=cvs))`  Args:     cvs: a tuple of `n` control bits, or",Quantum Logical Operators
/qualtran/qualtran.bloqs.mcmt.ctrl_spec_and.CtrlSpecAnd,"Computes a single qubit which is `1` iff the CtrlSpec of And clauses is satisfied.  This reduces an arbitrary 'And' clause control spec to a single qubit, which can be used to then control a bloq. Therefore, a bloq author is only required to implement a single-controlled version of their bloq, and c",Quantum Logical Operators
